key,0,1
#,,
int32,str,str
0,"TEXT_FESVLT502_03206_SEQ_00","※本任務是特定期間內的任務。

米·凱特露天劇場的莉賽特·德·瓦倫提昂有活動想要讓冒險者參加。"
1,"TEXT_FESVLT502_03206_SEQ_01","※本任務只有在季節活動開放期間才能接受和進行。
　季節活動結束後無法進行，敬請注意。
　詳情請參閱官方網站。

莉賽特催促冒險者去進行緣分占卜。分別和米·凱特露天劇場附近的溫和的占卜師、美艷的占卜師以及粗魯的占卜師聊聊，請她們占卜冒險機緣、寶藏運勢和愛情姻緣。"
2,"TEXT_FESVLT502_03206_SEQ_02","請占卜師們占卜了和對方的運勢。向米·凱特露天劇場的莉賽特·德·瓦倫提昂報告。"
3,"TEXT_FESVLT502_03206_SEQ_03","向莉賽特報告完畢。想要再次進行緣分占卜的話，就和她打聲招呼吧。"
4,"TEXT_FESVLT502_03206_SEQ_04",""
5,"TEXT_FESVLT502_03206_SEQ_05",""
6,"TEXT_FESVLT502_03206_SEQ_06",""
7,"TEXT_FESVLT502_03206_SEQ_07",""
8,"TEXT_FESVLT502_03206_SEQ_08",""
9,"TEXT_FESVLT502_03206_SEQ_09",""
10,"TEXT_FESVLT502_03206_SEQ_10",""
11,"TEXT_FESVLT502_03206_SEQ_11",""
12,"TEXT_FESVLT502_03206_SEQ_12",""
13,"TEXT_FESVLT502_03206_SEQ_13",""
14,"TEXT_FESVLT502_03206_SEQ_14",""
15,"TEXT_FESVLT502_03206_SEQ_15",""
16,"TEXT_FESVLT502_03206_SEQ_16",""
17,"TEXT_FESVLT502_03206_SEQ_17",""
18,"TEXT_FESVLT502_03206_SEQ_18",""
19,"TEXT_FESVLT502_03206_SEQ_19",""
20,"TEXT_FESVLT502_03206_SEQ_20",""
21,"TEXT_FESVLT502_03206_SEQ_21",""
22,"TEXT_FESVLT502_03206_SEQ_22",""
23,"TEXT_FESVLT502_03206_SEQ_23",""
24,"TEXT_FESVLT502_03206_TODO_00","組成2人小隊和占卜師聊聊"
25,"TEXT_FESVLT502_03206_TODO_01","向米·凱特露天劇場的莉賽特·德·瓦倫提昂報告"
26,"TEXT_FESVLT502_03206_TODO_02",""
27,"TEXT_FESVLT502_03206_TODO_03",""
28,"TEXT_FESVLT502_03206_TODO_04",""
29,"TEXT_FESVLT502_03206_TODO_05",""
30,"TEXT_FESVLT502_03206_TODO_06",""
31,"TEXT_FESVLT502_03206_TODO_07",""
32,"TEXT_FESVLT502_03206_TODO_08",""
33,"TEXT_FESVLT502_03206_TODO_09",""
34,"TEXT_FESVLT502_03206_TODO_10",""
35,"TEXT_FESVLT502_03206_TODO_11",""
36,"TEXT_FESVLT502_03206_TODO_12",""
37,"TEXT_FESVLT502_03206_TODO_13",""
38,"TEXT_FESVLT502_03206_TODO_14",""
39,"TEXT_FESVLT502_03206_TODO_15",""
40,"TEXT_FESVLT502_03206_TODO_16",""
41,"TEXT_FESVLT502_03206_TODO_17",""
42,"TEXT_FESVLT502_03206_TODO_18",""
43,"TEXT_FESVLT502_03206_TODO_19",""
44,"TEXT_FESVLT502_03206_TODO_20",""
45,"TEXT_FESVLT502_03206_TODO_21",""
46,"TEXT_FESVLT502_03206_TODO_22",""
47,"TEXT_FESVLT502_03206_TODO_23",""
48,"TEXT_FESVLT502_03206_LISETTE_000_000","冒險者、冒險者！
你是不是給阿絲幫忙呀？
小莉我都看到了，謝謝你啦！"
49,"TEXT_FESVLT502_03206_LISETTE_000_001","那孩子還只是新人愛情傳道士，
本來小莉我還是有點放不下心……
不過看來已經沒什麼問題啦！"
50,"TEXT_FESVLT502_03206_LISETTE_000_002","所以呢，人家叫住你就是想請你參加一下我負責的活動啦！
支援冒險者的愛情，也是我們愛情傳道士的工作哦！"
51,"TEXT_FESVLT502_03206_LISETTE_000_003","活動的內容就是占卜啦！
在露天劇場的外面有3位占卜師，
能分別占卜冒險機緣、寶藏運勢和愛情姻緣！"
52,"TEXT_FESVLT502_03206_LISETTE_000_004","是不是很有意思啊？！
是不是很感興趣呀？！"
53,"TEXT_FESVLT502_03206_LISETTE_000_005","只不過，占卜的時候和良緣儀式同樣，
要是沒有和想要占卜的同伴
一起組隊的話是無法進行占卜的，請多加注意哦！"
54,"TEXT_FESVLT502_03206_HORTEFENSE_000_006","小莉，你有件事情忘記告訴冒險者了哦。
這次的活動中好像有可疑的占卜師混了進來，
現在大家都在談論這件事呢。"
55,"TEXT_FESVLT502_03206_LISETTE_000_007","哎呀！是有這回事呀！
那個，確實是有一個不請自來的占卜師，
好像在擅自替別人進行占卜呢！"
56,"TEXT_FESVLT502_03206_HORTEFENSE_000_08","那個占卜師並沒有得到我們的許可，
所以請你注意不要去理會這個人。
對於正在進行奇怪占卜的人，一律無視就好了。"
57,"TEXT_FESVLT502_03206_LISETTE_000_009","那我就跟占卜師們打聲招呼，
如果有想要一起占卜的同伴了，就去跟她們聊聊吧！
啊，如果完成的話，還是要向我報告一下哦！"
58,"TEXT_FESVLT502_03206_LISETTE_000_015","你來找我的話，也就是說你想進行緣分占卜了吧！
那我就跟占卜師們打聲招呼了哦！"
59,"TEXT_FESVLT502_03206_LISETTE_000_016","你去和想要一起占卜的同伴組成一隊吧！
組完隊去找占卜師們聊聊吧！"
60,"TEXT_FESVLT502_03206_SYSTEM_000_020","在進行占卜前，需要先組成2人小隊。"
61,"TEXT_FESVLT502_03206_LISETTE_000_030","在和占卜師們聊聊前，
記得一定要和想要一起占卜的同伴進行組隊哦！
如果完成了的話，還是要向我報告一下哦！"
62,"TEXT_FESVLT502_03206_SYSTEM_000_031","在進行占卜前，需要先組成2人小隊。"
63,"TEXT_FESVLT502_03206_HORTEFENSE_000_032","請你務必小心謊稱是占卜師的騙子。"
64,"TEXT_FESVLT502_03206_TREASURELUCKTELLER03206_000_040","哎呀呀，兩位……
要不要來占卜一下「寶藏運勢」，看看你們巧遇寶藏的可能性？
畢竟俗話說得好，財盡緣分斷嘛……"
65,"TEXT_FESVLT502_03206_TREASURELUCKTELLER03206_000_050","哎呀呀，你沒有和別人組成兩人小隊啊。
等你找到同伴了，再一起組隊來找我吧。"
66,"TEXT_FESVLT502_03206_TREASURELUCKTELLER03206_000_060","來來來，讓我看看……
這位<Sheet(Race,PlayerParameter(71),0)/>的<If(PlayerParameter(4))>小姐<Else/>先生</If>，
你的冒險是從<Sheet(Town,PlayerParameter(70),0)/>開始的對吧？"
67,"TEXT_FESVLT502_03206_TREASURELUCKTELLER03206_000_061","然後呢，你的同伴是……
哎呀哎呀，這樣啊，從生日來看的話……
……我已經看到了，你們的寶藏機緣！"
68,"TEXT_FESVLT502_03206_TREASURELUCKTELLER03206_000_070","兩位即將迎來一陣黃金之風啊！
尤其是推薦你們去拉諾西亞的水邊，
找一個合適的地方怡然自得地享受釣魚之樂！"
69,"TEXT_FESVLT502_03206_TREASURELUCKTELLER03206_000_071","如果還沒有試過的話，不如以此為機會去嘗試一下吧。
你的幸運色是<Switch(PlayerParameter(70))><Case(1)>蜂蜜黃</Case><Case(2)>玫瑰粉</Case><Case(3)>風精靈綠</Case></Switch>……
把喜歡的衣服染成幸運色的話或許會很有效果呢。"
70,"TEXT_FESVLT502_03206_TREASURELUCKTELLER03206_000_080","兩位即將迎來一陣黃金之風啊！
尤其是推薦你們一起去森林中尋找良材，
揮下手斧來砍伐樹木！"
71,"TEXT_FESVLT502_03206_TREASURELUCKTELLER03206_000_081","經營木材生意也同樣可以帶動財運！
你的幸運色是<Switch(PlayerParameter(70))><Case(1)>玫瑰粉</Case><Case(2)>風精靈綠</Case><Case(3)>蜂蜜黃</Case></Switch>……
把喜歡的衣服染成幸運色的話或許會很有效果呢。"
72,"TEXT_FESVLT502_03206_TREASURELUCKTELLER03206_000_090","兩位即將迎來一陣黃金之風啊！
尤其是推薦你們一起去<Switch(PlayerParameter(70))><Case(1)>荒野</Case><Case(2)>海邊</Case><Case(3)>森林</Case></Switch>尋找石場，
揮動十字鎬，共同挑戰採掘工作！"
73,"TEXT_FESVLT502_03206_TREASURELUCKTELLER03206_000_091","在岩石的縫隙中間，或許能發現意料之外的寶藏哦！
你的幸運色是<Switch(PlayerParameter(70))><Case(1)>風精靈綠</Case><Case(2)>蜂蜜黃</Case><Case(3)>玫瑰粉</Case></Switch>……
把喜歡的衣服染成幸運色的話或許會很有效果呢。"
74,"TEXT_FESVLT502_03206_TREASURELUCKTELLER03206_000_100","兩位即將迎來一陣黃金之風啊！
尤其是推薦你們一起搭乘飛空艇，
前往金碟遊樂園玩個痛快！"
75,"TEXT_FESVLT502_03206_TREASURELUCKTELLER03206_000_101","我有預感，無論是什麼遊樂項目，其中都暗藏著幸運和寶藏！
你的幸運色是<Switch(PlayerParameter(70))><Case(1)>萄乾棕</Case><Case(2)>台地紅</Case><Case(3)>牧草綠</Case></Switch>……
把喜歡的衣服染成幸運色的話或許會很有效果呢。"
76,"TEXT_FESVLT502_03206_TREASURELUCKTELLER03206_000_110","怎麼說呢，占卜的結果說不上很好，但也不壞……
如果兩位想要提高巧遇寶物的機率的話，
建議你們去薩納蘭的水邊挑戰一下釣魚。"
77,"TEXT_FESVLT502_03206_TREASURELUCKTELLER03206_000_111","兩人共同食用海鮮食品也會很有效果！
另外，你的幸運色是<Switch(PlayerParameter(70))><Case(1)>猛豹黃</Case><Case(2)>沼澤綠</Case><Case(3)>鐵鏽棕</Case></Switch>……
穿上這個顏色的服飾，運氣也會有所提升吧。"
78,"TEXT_FESVLT502_03206_TREASURELUCKTELLER03206_000_120","怎麼說呢，占卜的結果說不上很好，但也不壞……
如果兩位想要提高巧遇寶物的機率的話，
可以到拉諾西亞尋找良材並試著採伐。"
79,"TEXT_FESVLT502_03206_TREASURELUCKTELLER03206_000_121","新置辦一些木質傢俱或工具也會很有效果！
另外，你的幸運色是<Switch(PlayerParameter(70))><Case(1)>沼澤綠</Case><Case(2)>鐵鏽棕</Case><Case(3)>猛豹黃</Case></Switch>……
穿上這個顏色的服飾，運氣也會有所提升吧。"
80,"TEXT_FESVLT502_03206_TREASURELUCKTELLER03206_000_130","怎麼說呢，占卜的結果說不上很好，但也不壞……
如果兩位想要提高巧遇寶物的機率的話，
就去黑衣森林的石場試著挑戰一下採掘吧。"
81,"TEXT_FESVLT502_03206_TREASURELUCKTELLER03206_000_131","在身上穿戴金屬或寶石製的物品也很有效果！
另外，你的幸運色是<Switch(PlayerParameter(70))><Case(1)>鐵鏽棕</Case><Case(2)>猛豹黃</Case><Case(3)>沼澤綠</Case></Switch>……
穿上這個顏色的服飾，運氣也會有所提升吧。"
82,"TEXT_FESVLT502_03206_TREASURELUCKTELLER03206_000_140","怎麼說呢，占卜的結果說不上很好，但也不壞……
如果兩位想要提高巧遇寶物的機率的話，
建議拿上寶物地圖，開啟你們的尋寶之旅。"
83,"TEXT_FESVLT502_03206_TREASURELUCKTELLER03206_000_141","就算一開始不太順利，只要堅持下去就會有好結果！
另外，你的幸運色是<Switch(PlayerParameter(70))><Case(1)>蘋果綠</Case><Case(2)>骸骨白</Case><Case(3)>苔蘚綠</Case></Switch>……
穿上這個顏色的服飾，運氣也會有所提升吧。"
84,"TEXT_FESVLT502_03206_TREASURELUCKTELLER03206_000_150","哎呀呀，真是糟糕得不忍直視……
可以考慮去黑衣森林釣釣魚，在霉運離開之前，
只有像潛伏於河底的魚那樣忍耐下去了……"
85,"TEXT_FESVLT502_03206_TREASURELUCKTELLER03206_000_151","另外要對海鮮食品多加注意……
誤食的話，有可能造成食物中毒等各種糟糕的情況。
準備一些<Switch(PlayerParameter(70))><Case(1)>奶油黃</Case><Case(2)>樹皮棕</Case><Case(3)>鮭魚粉</Case></Switch>色的物品，或許能幫你驅除惡運。"
86,"TEXT_FESVLT502_03206_TREASURELUCKTELLER03206_000_160","哎呀呀，真是糟糕得不忍直視……
可以考慮去薩納蘭砍砍樹，在霉運離開之前，
只有像隨風搖擺的柳樹那樣忍耐下去了……"
87,"TEXT_FESVLT502_03206_TREASURELUCKTELLER03206_000_161","另外要對木製品多加注意……
因為座椅壞掉結果受重傷的可能性也不是沒有。
準備一些<Switch(PlayerParameter(70))><Case(1)>樹皮棕</Case><Case(2)>鮭魚粉</Case><Case(3)>奶油黃</Case></Switch>色的物品，或許能幫你驅除惡運。"
88,"TEXT_FESVLT502_03206_TREASURELUCKTELLER03206_000_170","哎呀呀，真是糟糕得不忍直視……
可以考慮在拉諾西亞採採礦，在霉運離開之前，
只有像不動如山的大岩石那樣忍耐下去了……"
89,"TEXT_FESVLT502_03206_TREASURELUCKTELLER03206_000_171","另外要對寶石飾品多加注意……
說不定會有戒指上的寶石脫落之類的重大損失。
準備一些<Switch(PlayerParameter(70))><Case(1)>奶油黃</Case><Case(2)>樹皮棕</Case><Case(3)>鮭魚粉</Case></Switch>色的物品，或許能幫你驅除惡運。"
90,"TEXT_FESVLT502_03206_TREASURELUCKTELLER03206_000_180","哎呀呀，真是糟糕得不忍直視……
特別是尋寶的成果，還是不要過於期待為好。
比起一夜暴富的美夢，一點一滴地累積財富才是最好的。"
91,"TEXT_FESVLT502_03206_TREASURELUCKTELLER03206_000_181","可以堅持做做行會理符的任務，
在霉運過去之前儘量忍耐，你看怎麼樣？
準備一些<Switch(PlayerParameter(70))><Case(1)>青檸綠</Case><Case(2)>獵人綠</Case><Case(3)>橄欖綠</Case></Switch>色的物品，或許能幫你驅除惡運。"
92,"TEXT_FESVLT502_03206_TREASURELUCKTELLER03206_000_190","哎呀呀，真是糟糕得不忍直視……
我只能忠告你們千萬不要去金碟遊樂園揮霍無度。
極有可能將努力累積起來的金碟幣輸得一乾二淨！"
93,"TEXT_FESVLT502_03206_TREASURELUCKTELLER03206_000_191","站在撒溝厲沙漠南邊遠眺金碟遊樂園，
在霉運過去之前儘忍耐，你看怎麼樣？
準備一些<Switch(PlayerParameter(70))><Case(1)>獵人綠</Case><Case(2)>橄欖綠</Case><Case(3)>青檸綠</Case></Switch>色的物品，或許能幫你驅除惡運。"
94,"TEXT_FESVLT502_03206_TREASURELUCKTELLER03206_000_192","其他的占卜師分別擅長「冒險機緣」的占卜，
還有「愛情姻緣」的占卜，
請你也務必去試試看吧。"
95,"TEXT_FESVLT502_03206_ADVENTURELUCKTELLER03206_000_200","我比較擅長關於冒險運勢的占卜……
也就是「冒險機緣」的占卜。
想知道自己作為冒險者，與對方的契合度如何嗎？"
96,"TEXT_FESVLT502_03206_ADVENTURELUCKTELLER03206_100_210","你好像沒有配對呢。
先去找個同伴，再一起來我這裡吧。"
97,"TEXT_FESVLT502_03206_ADVENTURELUCKTELLER03206_000_220","我明白了，那麼就讓我來看一看吧。
首先從你開始……
……從事<Sheet(ClassJob,PlayerParameter(68),0)/>職業的<Sheet(Race,PlayerParameter(71),0)/>冒險者……"
98,"TEXT_FESVLT502_03206_ADVENTURELUCKTELLER03206_000_221","那麼你的同伴是什麼樣的呢……
……哎呀，是這麼一回事啊……
你們的緣分和運勢，我已經看清楚了！"
99,"TEXT_FESVLT502_03206_ADVENTURELUCKTELLER03206_000_230","這個結果真的是太棒了呢！
你們作為冒險者的緣分真是出類拔萃。
看樣子應該是受到了海之女神利姆萊茵的祝福啊。"
100,"TEXT_FESVLT502_03206_ADVENTURELUCKTELLER03206_000_231","就是說，在海上冒險的話會有好事發生！
相信我的預感，一起去海上展開冒險吧！"
101,"TEXT_FESVLT502_03206_ADVENTURELUCKTELLER03206_000_240","恭喜你們！
商貿之神納爾札爾正對你們展露微笑。
不論你們正在遭受什麼樣的不幸，都會有巨大的幸福隨之而來。"
102,"TEXT_FESVLT502_03206_ADVENTURELUCKTELLER03206_000_241","看樣子，在大地冒險的話會有好事發生！
相信我的預感，一起去內陸展開冒險吧！"
103,"TEXT_FESVLT502_03206_ADVENTURELUCKTELLER03206_000_250","恭喜你們！
戰爭神哈羅妮向你們伸出了援助之手。
擋在兩位面前的高牆，很快就會變成暢通無阻的大道。"
104,"TEXT_FESVLT502_03206_ADVENTURELUCKTELLER03206_000_251","看樣子，在空中的進行冒險的話會有好事發生。
相信我的預感，一起去高處展開冒險吧！"
105,"TEXT_FESVLT502_03206_ADVENTURELUCKTELLER03206_000_260","恭喜你們！
知識之神沙利亞克為二位準備了幸福的時間。
你們吵架吵得越凶，就越容易獲得巨大的成功呢。"
106,"TEXT_FESVLT502_03206_ADVENTURELUCKTELLER03206_000_261","不過吵完架之後要記得好好和好，這樣才能讓感情更進一步。
相信我的預感，展開你們的冒險吧！"
107,"TEXT_FESVLT502_03206_ADVENTURELUCKTELLER03206_000_270","恭喜你們！
就連行星神妮美雅都在為二位加油打氣。
只要你們齊心協力，沒有打不倒的強敵。"
108,"TEXT_FESVLT502_03206_ADVENTURELUCKTELLER03206_000_271","你們將會遇到新的同伴，
雖然現在仍然沒有交集，但我有種預感，
當時機到來時，會有未知的冒險等待著你們！"
109,"TEXT_FESVLT502_03206_ADVENTURELUCKTELLER03206_000_280","看樣子你們的緣分還不錯呢。
在漂浮於海面上的孤島冒險的話，會有好事發生，
但是一旦大意，可能會有不祥之事見縫進來！"
110,"TEXT_FESVLT502_03206_ADVENTURELUCKTELLER03206_000_281","在出發之前，二位可以去一趟利姆薩·羅敏薩的
利姆萊茵秘石那裡，祈禱冒險的成功。
冒險時將魚類作為護身符帶在身上也是極好的！"
111,"TEXT_FESVLT502_03206_ADVENTURELUCKTELLER03206_000_290","阿澤瑪的天平似乎保持著均衡。
從未知島嶼開始的冒險顯示出了吉兆，
但能否達成目的，還要看二位是否齊心協力了。"
112,"TEXT_FESVLT502_03206_ADVENTURELUCKTELLER03206_000_291","在出發之前，二位可以去一趟烏爾達哈的
納爾札爾秘石那裡，祈禱冒險的成功。
冒險時將寶石作為護身符帶在身上也是極好的！"
113,"TEXT_FESVLT502_03206_ADVENTURELUCKTELLER03206_000_300","工藝之神比爾格會幫忙添磚加瓦鞏固你們之間的關係。
如果你們在東方盡頭的大地的冒險遭遇了困難，
不要灰心放棄，要堅信自己離成功已經不遠了。"
114,"TEXT_FESVLT502_03206_ADVENTURELUCKTELLER03206_000_301","在出發之前，二位可以去一趟庫爾札斯中央高地的
哈羅妮秘石那裡，祈禱冒險的成功。
冒險時將長槍作為護身符帶在身上也是極好的！"
115,"TEXT_FESVLT502_03206_ADVENTURELUCKTELLER03206_000_310","諾菲卡說，即使二位之間矛盾不斷，也無須擔心。
現在正是為了讓成功開花結果而不斷探尋的時期。
就算如何勞碌困頓，也不要輕言放棄哦。"
116,"TEXT_FESVLT502_03206_ADVENTURELUCKTELLER03206_000_311","在出發之前，二位可以去一趟摩杜納的
沙利亞克秘石那裡，祈禱冒險的成功。
冒險時將貝類作為護身符帶在身上也是極好的！"
117,"TEXT_FESVLT502_03206_ADVENTURELUCKTELLER03206_000_320","梅茵菲娜為能看到兩位的齊心協力而欣喜。
只要在創造武器的冒險之路上繼續努力，
等到雙月盈滿之時，成功也會接踵而至吧。"
118,"TEXT_FESVLT502_03206_ADVENTURELUCKTELLER03206_000_321","在出發之前，二位可以去一趟黑衣森林南部林區的
比爾格秘石那裡，祈禱冒險的成功。
冒險時將錘子作為護身符帶在身上也是極好的！"
119,"TEXT_FESVLT502_03206_ADVENTURELUCKTELLER03206_000_330","這個結果……真是再糟糕不過了……
看樣子你們被海之女神利姆萊茵所拋棄，
如果出海冒險，恐怕有碰上船隻遇難的風險啊。"
120,"TEXT_FESVLT502_03206_ADVENTURELUCKTELLER03206_000_331","這樣一來只有前往拉諾西亞的奧修昂秘石那裡，
向山岳神奧修昂祈禱冒險之旅能夠平安無事……
不要勉強出海，以內陸地區為目標進行冒險比較好吧。"
121,"TEXT_FESVLT502_03206_ADVENTURELUCKTELLER03206_000_340","阿澤瑪的天平已經失衡，給予二位的是危險的審判。
看樣子你們被商貿之神納爾札爾所拋棄，
如果深入地底，恐怕有碰上地洞崩塌而遇難的風險呢。"
122,"TEXT_FESVLT502_03206_ADVENTURELUCKTELLER03206_000_341","這樣一來只有前往薩納蘭的阿澤瑪秘石那裡，
向太陽神阿澤瑪祈禱冒險之旅能夠平安無事……
在陽光照耀下的地方冒險應該會比較安全哦。"
123,"TEXT_FESVLT502_03206_ADVENTURELUCKTELLER03206_000_350","占卜的結果暗示著你們似乎觸怒了拉爾戈。
看樣子你們被戰爭神哈羅妮所拋棄，
如果在阿拉米格進行冒險的話，需要做出有所犧牲的覺悟哦。"
124,"TEXT_FESVLT502_03206_ADVENTURELUCKTELLER03206_000_351","這樣一來只有前往庫爾札斯的梅茵菲娜秘石那裡，
向月亮神梅茵菲娜祈禱冒險之旅能夠平安無事……
比起有勇無謀的探索，還是優先考慮人身的安全吧。"
125,"TEXT_FESVLT502_03206_ADVENTURELUCKTELLER03206_000_360","二位被捲入了阿爾基克所設計的陰謀之中啊。
看樣子你們被知識神沙利亞克所拋棄，
我感覺到在東方的某處，危險正在等待著你們的到來。"
126,"TEXT_FESVLT502_03206_ADVENTURELUCKTELLER03206_000_361","這樣一來只有前往拉諾西亞的妮美雅秘石那裡，
向行星神妮美雅祈禱冒險之旅能夠平安無事……
比起打倒強敵，要更優先保證同伴的安全才是啊。"
127,"TEXT_FESVLT502_03206_ADVENTURELUCKTELLER03206_000_370","哈羅妮在二位的冒險旅程中佈下了種種試煉。
看樣子你們被工藝神比爾格所拋棄，
要做好在創造武器之路上遭遇嚴峻考驗的心理準備。"
128,"TEXT_FESVLT502_03206_ADVENTURELUCKTELLER03206_000_371","這樣一來只有前往薩納蘭的拉爾戈秘石那裡，
向破壞神拉爾戈祈禱冒險之旅能夠平安無事……
重要的是切勿焦躁，一點一滴腳踏實地去挑戰。"
129,"TEXT_FESVLT502_03206_ADVENTURELUCKTELLER03206_000_372","你已經找過美艷的占卜師和粗魯的占卜師，
讓她們給你占卜了嗎？
最後別忘了記得向愛情傳道士報告一聲！"
130,"TEXT_FESVLT502_03206_COMPATIBILITYLUCKTELLER03206_000_380","我是「愛情姻緣」的占卜師，從來不會專挑好聽的說！
要是不介意的話，我就給你占卜。
怎麼樣，要不要給你們兩個占卜一下「愛情姻緣」？"
131,"TEXT_FESVLT502_03206_COMPATIBILITYLUCKTELLER03206_100_390","我說你啊，怎麼沒有跟人組成兩人小隊啊。
帶上你的同伴一起來啊！"
132,"TEXT_FESVLT502_03206_COMPATIBILITYLUCKTELLER03206_000_400","好，那就讓我來好好給你們瞧瞧！
……哦，你是<Switch(PlayerParameter(79))><Case(1)>星一月</Case><Case(2)>靈一月</Case><Case(3)>星二月</Case><Case(4)>靈二月</Case><Case(5)>星三月</Case><Case(6)>靈三月</Case><Case(7)>星四月</Case><Case(8)>靈四月</Case><Case(9)>星五月</Case><Case(10)>靈五月</Case><Case(11)>星六月</Case><Case(12)>靈六月</Case></Switch>出生的對吧？
負責該月運行的主神是<Switch(PlayerParameter(79))><Case(1)>哈羅妮</Case><Case(2)>梅茵菲娜</Case><Case(3)>沙利亞克</Case><Case(4)>妮美雅</Case><Case(5)>利姆萊茵</Case><Case(6)>奧修昂</Case><Case(7)>比爾格</Case><Case(8)>拉爾戈</Case><Case(9)>阿澤瑪</Case><Case(10)>納爾札爾</Case><Case(11)>諾菲卡</Case><Case(12)>阿爾基克</Case></Switch>，這樣的話……"
133,"TEXT_FESVLT502_03206_COMPATIBILITYLUCKTELLER03206_000_401","和你同伴的生日結合起來的話……
……噢噢，這樣啊，原來如此……
……你們的緣分應該就是這樣了！"
134,"TEXT_FESVLT502_03206_COMPATIBILITYLUCKTELLER03206_000_410","你們倆就好像命運共同體一樣，簡直是天造地設的一對啊。
在你的同伴看來，<Switch(PlayerParameter(79))><Case(1)>你是個值得信賴的好人</Case><Case(2)>你是個可以盡情撒嬌的對象</Case><Case(3)>你是個足以託付後背的可靠之人</Case><Case(4)>你簡直可愛得不得了</Case><Case(5)>你簡直令人陶醉得難以自拔</Case><Case(6)>哪怕被你看到睡臉也無所謂</Case><Case(7)>你是個可以放鬆警惕的對象</Case><Case(8)>你是個可以以拳交心的好對手</Case><Case(9)>你是個值得傾訴真心的好聽眾</Case><Case(10)>你們就像親兄弟姐妹一樣親密無間</Case><Case(11)>你們就像搭檔一樣互相信賴</Case><Case(12)>你是那麼秀色可餐，真想把你一口吃掉</Case></Switch>。
不過可別因為這樣就飄飄然，忽視對方的感受哦？"
135,"TEXT_FESVLT502_03206_COMPATIBILITYLUCKTELLER03206_000_411","作為一個<Switch(PlayerParameter(71))><Case(1)>人族</Case><Case(2)>精靈族</Case><Case(3)>拉拉菲爾族</Case><Case(4)>貓魅族</Case><Case(5)>魯加族</Case><Case(6)>敖龍族</Case><Case(7)>硌獅族</Case><Case(8)>維艾拉族</Case></Switch><If(PlayerParameter(4))>女性<Else/>男性</If>，就應該穿上合身的衣裝讓對方開心。
如果連這點程度的關心和體貼都做不到，
重要的伴侶可是會離你而去的！"
136,"TEXT_FESVLT502_03206_COMPATIBILITYLUCKTELLER03206_000_420","你們倆就好像命運共同體一樣，簡直是天造地設的一對啊。
在你的同伴看來，<Switch(PlayerParameter(79))><Case(1)>你簡直可愛得不得了</Case><Case(2)>你簡直令人陶醉得難以自拔</Case><Case(3)>哪怕被你看到睡臉也無所謂</Case><Case(4)>你是個可以放鬆警惕的對象</Case><Case(5)>你是個可以以拳交心的好對手</Case><Case(6)>你是個值得傾訴真心的好聽眾</Case><Case(7)>你們就像親兄弟姐妹一樣親密無間</Case><Case(8)>你們就像搭檔一樣互相信賴</Case><Case(9)>你是那麼秀色可餐，真想把你一口吃掉</Case><Case(10)>你是個值得信賴的好人</Case><Case(11)>你是個可以盡情撒嬌的對象</Case><Case(12)>你是個足以託付後背的可靠之人</Case></Switch>。
不過可別因為這樣就飄飄然，忽視對方的感受哦？"
