key,0,1
159,"TEXT_SUBWIL901_04779_RASHAHT_000_138","<If(Equal(PlayerParameter(76),1))>我想就不需要我特地說了吧？<Else/>沒錯，就是那位人稱光之戰士的冒險者。</If>
卻因為戰鬥過於激烈，無法明確記錄下來，這實在是非常可惜。
唯一能夠保證的就是，派出去的戰士們確實成功擊斃了奈爾。"
160,"TEXT_SUBWIL901_04779_RASHAHT_000_139","然而，就像你們知道的那樣，事情到這裡並非就完全解決了。
根據路易索瓦大人的調查結果顯示，
衛月仍然在朝著艾奧傑亞墜落。"
161,"TEXT_SUBWIL901_04779_RASHAHT_000_140","面對這種現狀，救世詩盟向各國求援。
為了防止衛月墜落，施展最後的秘術，
需要我們控制第七軍團聚集的加爾提諾平原。"
162,"TEXT_SUBWIL901_04779_RASHAHT_000_141","救世詩盟提出了前所未有的計策，他們將透過請神術，
召喚艾奧傑亞十二神的力量，將衛月推回到天空之上……
為此，需要我們控制住衛月的最終墜落點。"
163,"TEXT_SUBWIL901_04779_RASHAHT_000_142","於是，加爾提諾平原之戰就這樣拉開了帷幕……
之後發生了什麼……你們也是知道的吧。"
164,"TEXT_SUBWIL901_04779_NANANJI_000_143","漆黑的巨龍巴哈姆特從墜落的衛月之中突然現身，
將艾奧傑亞全境投入了一片火海之中……
誰也不曾想過靈災會以這樣的形式發生。"
165,"TEXT_SUBWIL901_04779_RASHAHT_000_144","沒錯，但路易索瓦大人發動了秘術之後的事……
他和巴哈姆特最終經歷了什麼，
為什麼這片大地會重獲新生，卻成為無人知曉的謎團。"
166,"TEXT_SUBWIL901_04779_NANANJI_000_145","靈災後遺症導致的記憶紊亂嗎？
對了，在臨近加爾提諾平原之戰的那段時間裡，
你是否知道有和他關係親密，並與他有過交流的人？"
167,"TEXT_SUBWIL901_04779_RASHAHT_000_146","路易索瓦大人為了施展秘術，
一直待在能夠縱覽戰場的丘陵之上，
……而我總是衝在最前線作戰，所以對他的情況了解不多。"
168,"TEXT_SUBWIL901_04779_RASHAHT_000_147","這我只能回答你我不知道了。
抱歉，幫不了你。"
169,"TEXT_SUBWIL901_04779_NANANJI_000_148","沒有沒有，能聽到這麼多貴重的情報，我已經十分感謝你了。
多虧了你，我才瞭解了加爾提諾平原一戰的始末。"
170,"TEXT_SUBWIL901_04779_RASHAHT_000_149","那就太好了！
那麼，我就回去工作啦！
等你寫完了傳記，一定要讓我拜讀一下哦！"
171,"TEXT_SUBWIL901_04779_NANANJI_000_150","這算是搞清楚了整個第七靈災從頭到尾的經過了吧……唔。"
172,"TEXT_SUBWIL901_04779_NANANJI_000_151","啊，抱歉，我想入神了……
謝謝你陪我來做採訪，多虧了有你在，
我才能問到這麼多當時的消息。"
173,"TEXT_SUBWIL901_04779_NANANJI_000_152","不過，我還有其他無論如何都想知道的情報。
有你幫忙的話，也許可以再採訪到些別的什麼……
如果你方便的話，請再來找我吧。"
