key,0,1
#,,
int32,str,str
0,"TEXT_BANANA001_03036_SEQ_00","<UIForeground>F201FC</UIForeground><UIGlow>F201FD</UIGlow>特殊規則： 等級調整（限定職業）<UIGlow>01</UIGlow><UIForeground>01</UIForeground>
對等石的梅·拉茲·努恩有事想要告訴冒險者。"
1,"TEXT_BANANA001_03036_SEQ_01","※本任務為<UIForeground>F201FC</UIForeground><UIGlow>F201FD</UIGlow><UIGlow>01</UIGlow><UIForeground>01</UIForeground> 等級調整（限定職業）任務，
　需要與接受任務時的職業相同才可繼續進行任務。

從梅·拉茲·努恩處得知了薩利夏正在尋找冒險者。前往基拉巴尼亞邊區的勇巢，和薩利夏談談。"
2,"TEXT_BANANA001_03036_SEQ_02","薩利夏想要把參加了解放軍的女兒阿露帕叫回勇巢來。將<Sheet(EventItem,2002425,0)/>交給神拳痕的阿露帕。"
3,"TEXT_BANANA001_03036_SEQ_03","阿露帕就任了新設立的國境警備隊的隊長，因此暫時不會回勇巢。而且阿露帕也有事想和冒險者商量。和威羅迪納基地的阿露帕談談。"
4,"TEXT_BANANA001_03036_SEQ_04","和阿露帕進行了交談。國境警備隊為了解決人手不足的問題，準備把一部分任務交給冒險者們。阿露帕的母親薩利夏表示，等到自己下次蛻皮結束時，如果威羅迪納大橋還沒辦法變成足以守護國境的關口的話，就會去把女兒帶回勇巢。作為國境警備隊成立的標誌，威羅迪納大橋升起了隊旗。支援警備隊長阿露帕，為今後關口的發展出力吧！"
5,"TEXT_BANANA001_03036_SEQ_05",""
6,"TEXT_BANANA001_03036_SEQ_06",""
7,"TEXT_BANANA001_03036_SEQ_07",""
8,"TEXT_BANANA001_03036_SEQ_08",""
9,"TEXT_BANANA001_03036_SEQ_09",""
10,"TEXT_BANANA001_03036_SEQ_10",""
11,"TEXT_BANANA001_03036_SEQ_11",""
12,"TEXT_BANANA001_03036_SEQ_12",""
13,"TEXT_BANANA001_03036_SEQ_13",""
14,"TEXT_BANANA001_03036_SEQ_14",""
15,"TEXT_BANANA001_03036_SEQ_15",""
16,"TEXT_BANANA001_03036_SEQ_16",""
17,"TEXT_BANANA001_03036_SEQ_17",""
18,"TEXT_BANANA001_03036_SEQ_18",""
19,"TEXT_BANANA001_03036_SEQ_19",""
20,"TEXT_BANANA001_03036_SEQ_20",""
21,"TEXT_BANANA001_03036_SEQ_21",""
22,"TEXT_BANANA001_03036_SEQ_22",""
23,"TEXT_BANANA001_03036_SEQ_23",""
24,"TEXT_BANANA001_03036_TODO_00","和勇巢的薩利夏對話"
25,"TEXT_BANANA001_03036_TODO_01","將<Sheet(EventItem,2002425,0)/>交給神拳痕的阿露帕"
26,"TEXT_BANANA001_03036_TODO_02","和威羅迪納基地的阿露帕對話"
27,"TEXT_BANANA001_03036_TODO_03",""
28,"TEXT_BANANA001_03036_TODO_04",""
29,"TEXT_BANANA001_03036_TODO_05",""
30,"TEXT_BANANA001_03036_TODO_06",""
31,"TEXT_BANANA001_03036_TODO_07",""
32,"TEXT_BANANA001_03036_TODO_08",""
33,"TEXT_BANANA001_03036_TODO_09",""
34,"TEXT_BANANA001_03036_TODO_10",""
35,"TEXT_BANANA001_03036_TODO_11",""
36,"TEXT_BANANA001_03036_TODO_12",""
37,"TEXT_BANANA001_03036_TODO_13",""
38,"TEXT_BANANA001_03036_TODO_14",""
39,"TEXT_BANANA001_03036_TODO_15",""
40,"TEXT_BANANA001_03036_TODO_16",""
41,"TEXT_BANANA001_03036_TODO_17",""
42,"TEXT_BANANA001_03036_TODO_18",""
43,"TEXT_BANANA001_03036_TODO_19",""
44,"TEXT_BANANA001_03036_TODO_20",""
45,"TEXT_BANANA001_03036_TODO_21",""
46,"TEXT_BANANA001_03036_TODO_22",""
47,"TEXT_BANANA001_03036_TODO_23",""
48,"TEXT_BANANA001_03036_MRAHZNUN_000_001","別來無恙啊，冒險者。"
49,"TEXT_BANANA001_03036_MRAHZNUN_000_002","賢者樹那件事承蒙關照了。
多虧了你與梅·賽特的活躍表現，
伽黎亞派已經不再接近那棵樹了。"
50,"TEXT_BANANA001_03036_MRAHZNUN_000_003","說到這，前幾天毗羅派派來了使者，
說是她們的領導者薩利夏正在找你。
等你有興趣的時候，就去勇巢看看吧。"
51,"TEXT_BANANA001_03036_SARISHA_000_010","嘶——人類朋友啊，歡迎你。"
52,"TEXT_BANANA001_03036_SARISHA_000_011","首先，請讓我再次向你道謝。
感謝你打倒了伽黎亞派召喚出的假美神。
此外，我有件事想要找你商量。"
53,"TEXT_BANANA001_03036_SARISHA_000_012","沒想到伽黎亞派竟然會再次召喚出美神……
我們真是被你幫了許多次呢。
不過今天找你來是我有件事想要和你商量。"
54,"TEXT_BANANA001_03036_SARISHA_000_013","我有個參加了解放軍的女兒，名叫阿露帕。
她不擅長戰鬥，作為鬥士而言還很不成熟，
但她卻立志追求自由而奮戰至今。"
55,"TEXT_BANANA001_03036_SARISHA_000_014","為了讓她作為我的繼承人而進行鍛鍊，
我想要先把女兒叫回勇巢。"
56,"TEXT_BANANA001_03036_SARISHA_000_015","雖說已經得到了解放，可艱難的生活不會那麼快結束。
為了取回過去那樣獨立的生活，
領導者需要有無與倫比的領導力。"
57,"TEXT_BANANA001_03036_SARISHA_000_016","為此，我給女兒寫了一封信，
讓她提前退伍，回到勇巢來。
我想拜託你把這封信轉交給她。"
58,"TEXT_BANANA001_03036_SARISHA_100_016","你在解放軍上層也有人脈吧？
把信交給我女兒以後，如果在她退伍的時候有什麼麻煩的話，
希望你能幫幫她。"
59,"TEXT_BANANA001_03036_Q1_000_000","如何作答？"
60,"TEXT_BANANA001_03036_A1_000_001","就交給我吧"
61,"TEXT_BANANA001_03036_A1_000_002","如果只是露個臉的話……"
62,"TEXT_BANANA001_03036_SARISHA_000_018","嘶——十分感謝。
謝謝你對我們這麼好。"
63,"TEXT_BANANA001_03036_SARISHA_000_019","那麼，我就把信交給你了，
請你轉交給神拳痕的阿露帕。
拜託你了。"
64,"TEXT_BANANA001_03036_MRAHZNUN_000_020","前幾天毗羅派派來了使者，
說是她們的領導者薩利夏正在找你。
等你有興趣的時候，就去勇巢看看吧。"
65,"TEXT_BANANA001_03036_ALPA_000_030","嘶——我就是阿露帕……
什麼？母親給我寫了信？"
66,"TEXT_BANANA001_03036_ALPA_000_031","我看看……"
67,"TEXT_BANANA001_03036_ALPA_000_032","信的內容我明白了……但是，我無法接受！
竟然叫我離開解放軍，回勇巢去，
母親她到底在想什麼啊！"
68,"TEXT_BANANA001_03036_ALPA_000_033","雖然很感激她期待我能成為下一任領導者，
可我在這還有事要做！"
69,"TEXT_BANANA001_03036_JOLHMYN_000_034","你冷靜點，阿露帕。"
70,"TEXT_BANANA001_03036_JOLHMYN_100_034","首先，對把信送來的冒險者，
你應該有話要說吧？"
71,"TEXT_BANANA001_03036_ALPA_000_035","嘶——抱，抱歉，讓你見笑了。
感謝你特地把信送過來……"
72,"TEXT_BANANA001_03036_ALPA_000_036","嗯嗯？！你不是奪回了威羅迪納大橋的英雄<Highlight>ObjectParameter(1)</Highlight>嗎！"
73,"TEXT_BANANA001_03036_JOLHMYN_000_037","我可是一開始就認出來了的。"
74,"TEXT_BANANA001_03036_JOLHMYN_000_038","能親眼見到身經百戰的英雄真是榮幸。
我是嘉·奧爾敏……請多關照。"
75,"TEXT_BANANA001_03036_ALPA_000_039","嘶——既然是令人敬仰的英雄來送信，
那我也必須告訴你我不能回勇巢的理由。"
76,"TEXT_BANANA001_03036_ALPA_000_040","我雖然自稱是一名鬥士，可卻不擅長戰鬥……
所幸我還有冶煉金屬這個特長，
因此被任命管理負責後方支援的工兵隊。"
77,"TEXT_BANANA001_03036_ALPA_000_041","為解放軍做貢獻的方法，並不是只有在前線戰鬥一種，
這我也知道……
只是，奪回威羅迪納大橋的捷報讓我的心也為之激盪了起來。"
78,"TEXT_BANANA001_03036_ALPA_000_042","我也想要去外面做貢獻……就在我開始這麼想的時候，
得知了解放軍要將威羅迪納大橋作為國境的關口，
並在那裡設立國境警備隊的計劃。"
79,"TEXT_BANANA001_03036_ALPA_000_043","（★未使用／削除予定★）"
80,"TEXT_BANANA001_03036_JOLHMYN_100_043","然後，阿露帕竟然莽撞地提出要當警備隊長，
不知為何上面還同意了。
不過條件是讓我做她的副官。"
81,"TEXT_BANANA001_03036_ALPA_100_044","解放軍的部隊大多數都是由人類與阿難陀族混合編成的。
但是我之前所屬的工兵隊，
是完全由擅長冶煉金屬的阿難陀族組成的部隊。"
82,"TEXT_BANANA001_03036_ALPA_200_044","這導致我與人類接觸的機會比較少。
高層考慮到這一點，決定派身為人類的奧爾敏來做警備隊的副官，
以此作為讓我當警備隊長的條件。"
83,"TEXT_BANANA001_03036_JOLHMYN_200_044","也就是說我是來盯著阿露帕，
負責監督她讓她別太亂來的。"
84,"TEXT_BANANA001_03036_JOLHMYN_300_044","實際上，阿露帕還真是個怪人，
之前還突然要來脫掉我的防具……"
85,"TEXT_BANANA001_03036_ALPA_400_044","嘶嘶？！
我都說了，那個是誤會啊！
我只是想要幫你蛻皮的！"
86,"TEXT_BANANA001_03036_JOLHMYN_400_044","那個啊，我也說了許多次了，
人類是不會蛻皮的！"
87,"TEXT_BANANA001_03036_ALPA_500_044","……話說回來，
是母親拜託你來帶我回去的吧……"
88,"TEXT_BANANA001_03036_ALPA_000_044","這是我好不容易抓住的機會，不會就這樣半途而廢地回去。
我會給母親寫封信，向她講明緣由，讓我的部下送過去的。
這次因為我的事讓你受累了，真是對不起。"
89,"TEXT_BANANA001_03036_ALPA_000_045","請、請稍微等一下！"
90,"TEXT_BANANA001_03036_ALPA_000_046","在這裡見到了，也是有緣……我有事想要和你商量！
如果方便的話，你能聽我說說嗎？"
91,"TEXT_BANANA001_03036_ALPA_000_047","嘶——太感謝你了！
我會在威羅迪納基地對你詳細說明的！
麻煩你跑一趟了！"
92,"TEXT_BANANA001_03036_SARISHA_000_050","你在解放軍上層也有人脈吧？
把信交給我女兒以後，如果在她退伍的時候有什麼麻煩的話，
希望你能幫幫她。"
93,"TEXT_BANANA001_03036_JOLHMYN_000_055","怎麼了？
你找我們有什麼事嗎？"
94,"TEXT_BANANA001_03036_ALPA_000_060","嘶——多謝你特地跑一趟！
想和你商量的事不是別的，是關於要在這座橋上設立的關口的事。"
95,"TEXT_BANANA001_03036_ALPA_000_061","這座橋是通往格里達尼亞方面的交通要道……
雖然現在這座橋上的行人大都是同盟軍或解放軍的相關人士，
但和臨近各國開始往來以後，民間人士也會增多。"
96,"TEXT_BANANA001_03036_ALPA_000_062","然而以應對帝國軍這一重大威脅為目的的話，
設定在西側關口的國境警備隊員人數有些太少了。"
97,"TEXT_BANANA001_03036_ALPA_000_063","這種情況下，別的國家是怎麼做的呢？
遊歷過各國的你，應該知道解決方法吧？"
98,"TEXT_BANANA001_03036_Q2_000_000","如何作答？"
99,"TEXT_BANANA001_03036_A2_000_001","大國防聯軍設立了冒險者部隊"
100,"TEXT_BANANA001_03036_A2_000_002","伊修加爾德會發行理符"
101,"TEXT_BANANA001_03036_ALPA_000_065","嘶——原來如此，用冒險者來填補不足的人手是吧？
那麼我們國境警備隊也多找來一些冒險者，
把一部分任務交給他們吧！"
102,"TEXT_BANANA001_03036_ALPA_000_082","接下來會忙起來的！
不好意思，能請<Highlight>ObjectParameter(1)</Highlight>你也來幫忙嗎？"
103,"TEXT_BANANA001_03036_Q3_000_000","來給阿露帕國境警備隊的任務幫忙嗎？"
104,"TEXT_BANANA001_03036_A3_000_001","嘶——就幫幫你們吧。"
105,"TEXT_BANANA001_03036_A3_000_002","我可不幹！"
106,"TEXT_BANANA001_03036_ALPA_100_082","嘶——太感謝了！
那就指望你了啊！"
107,"TEXT_BANANA001_03036_ALPA_200_082","嘶——那真是太遺憾了……
可是也不能強行挽留住你這樣的英雄。
如果你回心轉意了的話，隨時再來找我吧！"
108,"TEXT_BANANA001_03036_ALPA_000_066","這樣的話，就快點準備……"
109,"TEXT_BANANA001_03036_ALPA_100_066","嗯嗯？！有人過來了，難道是……"
110,"TEXT_BANANA001_03036_ALPA_000_067","嘶、嘶——母、母親！"
111,"TEXT_BANANA001_03036_ALPA_000_068","（★未使用／削除予定★）"
112,"TEXT_BANANA001_03036_SARISHA_000_069","嘶——我的女兒阿露帕啊。
你讓姐妹捎給我的信我已經看過了。
你當上國境警備隊的隊長了啊……"
113,"TEXT_BANANA001_03036_ALPA_000_070","正、正是如此！
我還有應盡的責任！
因此不能回勇巢去！"
114,"TEXT_BANANA001_03036_SARISHA_000_071","哦……你所說的應盡的責任是指什麼呢？"
115,"TEXT_BANANA001_03036_ALPA_100_072","當然是把這座威羅迪納大橋，
變成足以守護基拉巴尼亞的關口！"
116,"TEXT_BANANA001_03036_SARISHA_000_072","不擅長戰鬥的你，能做得到這一點嗎？"
117,"TEXT_BANANA001_03036_SARISHA_100_072","既然你已下定決心了……那我就同意吧。
威羅迪納河上能有個防守嚴密的關口的話，
我們處於邊區的巢穴也能得到安全上的保障。"
118,"TEXT_BANANA001_03036_SARISHA_200_072","但是，你身為毗羅派下一任領導者候補，
不能讓我就這麼一直等下去。
因此，我要給你設一個期限。"
119,"TEXT_BANANA001_03036_SARISHA_300_072","等我下一次蛻皮結束以後，會再來視察。
到那時，如果你還是沒有把這座橋變成足夠守護國境的關口的話，
我就強行把你帶回巢裡去。"
120,"TEXT_BANANA001_03036_ALPA_000_073","求、求之不得！
我一定會建起讓母親您目瞪口呆的壯觀關口！
如果辦不到，您要帶我去哪都行！"
121,"TEXT_BANANA001_03036_SARISHA_000_074","嘶——你真的辦得到嗎，我就拭目以待吧。"
122,"TEXT_BANANA001_03036_SARISHA_100_074","真是給你添了不少麻煩呀。
我女兒還不成熟，請你多擔待。"
123,"TEXT_BANANA001_03036_JOLHMYN_000_075","大橋變成關口的話，勇巢就會更安全，
就算失敗了，下一任領導者也會回來……
你母親還真是高明啊。"
124,"TEXT_BANANA001_03036_ALPA_000_076","嘶——不會失敗的。
我會對國境警備隊投入全身心的熱情,
一定要建成一座壯觀的關口！"
125,"TEXT_BANANA001_03036_ALPA_000_077","（★未使用／削除予定★）"
126,"TEXT_BANANA001_03036_JOLHMYN_000_078","那麼，要從哪裡開始著手呢？"
127,"TEXT_BANANA001_03036_ALPA_000_079","嘶——從國境警備隊的任務當中，
選出能交給冒險者做的，並向他們發行！
當然了，相對的報酬也要準備好！"
128,"TEXT_BANANA001_03036_JOLHMYN_000_080","我明白了。
也讓耶夏娜和摩偷羅她們來幫忙吧。"
129,"TEXT_BANANA001_03036_ALPA_000_081","嘶——距離母親蛻皮的時期應該還有些時間。
總之先升起我們國境警備隊的標誌——隊旗，
以此來宣佈我們國境警備隊的正式成立！"
130,"TEXT_BANANA001_03036_ALPA_100_081","<Highlight>ObjectParameter(1)</Highlight>，
也請你來助我一臂之力吧！"
131,"TEXT_BANANA001_03036_SYSTEM_000_083","威羅迪納基地現在設立了國境警備隊。"
132,"TEXT_BANANA001_03036_SYSTEM_000_084","由於冒險者的努力，
與阿難陀族「阿露帕國境警備隊」的關係程度到達了「友好」。
開啟了阿難陀族的友好部族任務。"
133,"TEXT_BANANA001_03036_SYSTEM_000_085","今後可以在威羅迪納基地的耶夏娜處，
接受可重複進行的友好部族日常任務。"
134,"TEXT_BANANA001_03036_SYSTEM_000_086","並且可以在「摩偷羅」處購入友好部族所經營的商品。
在今後的冒險裡善加利用吧！"
135,"TEXT_BANANA001_03036_JOLHMYN_000_090","阿露帕說有事要拜託你。"
