key,0,1
#,,
int32,str,str
0,"TEXT_CTSMJICONTACTNPC_00807_OPERATORMAMMET_000_000","如果塔塔露聯繫過來的話，我會告訴你的！"
1,"TEXT_CTSMJICONTACTNPC_00807_OPERATORMAMMET_000_010","如果塔塔露聯繫過來的話，我還是會提醒你的！"
2,"TEXT_CTSMJICONTACTNPC_00807_OPERATORMAMMET_000_020","歡迎！歡迎！
希望你在島上玩得開心！"
3,"TEXT_CTSMJICONTACTNPC_00807_OPERATORMAMMET_000_030","現在島上正有客人拜訪！
希望客人們能在島上度過一段愉快的時光！"
4,"TEXT_CTSMJICONTACTNPC_00807_OPERATORMAMMET_000_040","塔塔露打算再邀請一組客人來島上拜訪。
如果她聯繫過來的話，我還是會提醒你的！"
5,"TEXT_CTSMJICONTACTNPC_00807_OPERATORMAMMET_000_050","現在沒有人聯絡你工作哦！
你可以悠閒度日，完成自己設定的每日目標，
也可以邀請朋友來島上玩，我們十分歡迎新的客人來訪！"
