key,0,1
188,"TEXT_CHRHDB301_01438_NASHUMHAKARACCA_000_608","「布里亞迪安會被炸死」
……好了，我記下來了。"
189,"TEXT_CHRHDB301_01438_ELLIE_000_609","……記錄得太斷章取義了，
聽起來像是要殺布里亞迪安的做案預告一樣。"
190,"TEXT_CHRHDB301_01438_ELLIE_000_610","……布里亞迪安回來了！"
191,"TEXT_CHRHDB301_01438_ELLIE_000_611","你們本該在進行監視任務才對，
是不是快點藏起來比較好？"
192,"TEXT_CHRHDB301_01438_HILDIBRAND_000_612","但、但炸彈的事要是敗露了，
我們豈不是會被罵得更慘？！"
193,"TEXT_CHRHDB301_01438_ELLIE_000_613","好吧，之前沒出手阻止你調查的我也算是共犯……
那麼，我們兩個去拖住布里亞迪安，
你們快藏起來。"
194,"TEXT_CHRHDB301_01438_HILDIBRAND_000_614","不愧是艾莉閣下，實在太可靠了！
炸彈等到布里閣下離開後再回收吧。
那之後就拜託了！"
