key,0,1
438,"TEXT_VOICEMAN_06500_004080_KRILE","這封信可有些年頭了……
如果內容重要，可得好好保存起來。"
439,"TEXT_VOICEMAN_06500_004085_KRILE","啊？"
440,"TEXT_VOICEMAN_06500_004090_KRILE","收件人是加拉夫爺爺！
寄件人是……“圖萊尤拉聯合王國”……古魯什麼什麼……"
441,"TEXT_VOICEMAN_06500_004100_KRILE","不行……後面看不清了……"
442,"TEXT_VOICEMAN_06500_004110_KRILE","嗯，還寫了什麼東西呢……"
443,"TEXT_VOICEMAN_06500_004120_KRILE","調查委託？圖拉爾大陸上的“黃金鄉”？！"
444,"TEXT_VOICEMAN_06500_004130_KRILE","奇怪……
巴爾德西昂委員會進行過這樣的調查嗎……
我沒看到過任何記錄啊。"
445,"TEXT_VOICEMAN_06500_004140_KRILE","欸？裡面好像還有東西……"
446,"TEXT_VOICEMAN_06500_004150_KRILE","這個耳飾的造型真奇特啊。
和委託內容有什麼關係嗎？"
447,"TEXT_VOICEMAN_06500_004160_KRILE","圖拉爾大陸、黃金鄉……
爺爺去過那裡嗎……"
448,"TEXT_VOICEMAN_06500_004170_ERENVILLE","唉……"
449,"TEXT_VOICEMAN_06500_004180_ERENVILLE","沒想到這麼快就回來了，
早知道都不用專門去跟可露兒打那聲招呼……"
450,"TEXT_VOICEMAN_06500_004190_ERENVILLE","這裡就是知識之都薩雷安。"
451,"TEXT_VOICEMAN_06500_004200_ERENVILLE","和圖萊尤拉區別很大吧？"
452,"TEXT_VOICEMAN_06500_004210_ERENVILLE","走吧，我給你帶路，找那位冒險者去。"
