key,0,1
#,,
int32,str,str
0,"TEXT_CTSDKBCHARACTER4SUB1_00578_YALANA_000_000","哎呀，你是旅行者嗎？
為了給水晶都的糧食排程做出貢獻，
目前這裡正在進行著肥料的改良與土壤的研究。"
1,"TEXT_CTSDKBCHARACTER4SUB1_00578_YALANA_000_010","啊，<Highlight>ObjectParameter(1)</Highlight>！
大地資源部的科希·芮部長有沒有再給你添麻煩啊？"
2,"TEXT_CTSDKBCHARACTER4SUB1_00578_YALANA_000_020","我承認我很喜歡研究疑似是薩邁爾的巨大生物！
但我可不會像科希·芮部長那樣丟下工作不管！"
3,"TEXT_CTSDKBCHARACTER4SUB1_00578_YALANA_000_030","真是的，真拿茂那傢伙沒轍。
多虧了你才能把他平安帶回來……"
4,"TEXT_CTSDKBCHARACTER4SUB1_00578_YALANA_000_031","不論是科希·芮部長還是茂，
若想找到薩邁爾的話，首先得要把自己放在第一位才行！
真是的，他們總是像傻瓜一樣只顧一個勁地向前衝……"
5,"TEXT_CTSDKBCHARACTER4SUB1_00578_YALANA_000_040","啊，<Highlight>ObjectParameter(1)</Highlight>！
薩邁爾的研究進行得很順利！
前幾天在珂露西亞島還發現了薩邁爾的蛋殼！"
