key,0,1
371,"TEXT_VOICEMAN_06002_003550_GRAHATIA","雖然算不上一帆風順，
但日後回憶起這段旅程時，
我一定會面帶著微笑吧。"
372,"TEXT_VOICEMAN_06002_003560_GRAHATIA","大家在審問會上據理力爭，在冰天雪地中艱苦前進，
在這個房間裡一起吃晚餐……"
373,"TEXT_VOICEMAN_06002_003570_GRAHATIA","今後一定還會有更多這種體驗吧。
既然你說了要帶我冒險，那就得負起責任，
帶我去到世界的盡頭甚至更遙遠的地方！"
374,"TEXT_VOICEMAN_06002_003580_GRAHATIA","我、我要說的就這些……抱歉打擾你了……
明天可能會很忙，你還是早點休息吧。"
375,"TEXT_VOICEMAN_06002_003590_GRAHATIA","晚安，祝你做個好夢。"
376,"TEXT_VOICEMAN_06002_003600_ESTINIEN","打擾了，就你自己？"
377,"TEXT_VOICEMAN_06002_003610_ESTINIEN","那對雙胞胎跑到了我的房間，
又是讓我吃飯又是讓我做好準備的……"
378,"TEXT_VOICEMAN_06002_003620_ESTINIEN","我嫌煩，就趁機跑出來了。
果然還是你這裡安靜啊。"
379,"TEXT_VOICEMAN_06002_003630_ESTINIEN","不過我還要說幾句……你們怎麼總是這樣。"
380,"TEXT_VOICEMAN_06002_003640_ESTINIEN","無論是龍詩戰爭還是什麼更麻煩的事，
你們都會毫不猶豫地參與進去。"
381,"TEXT_VOICEMAN_06002_003650_ESTINIEN","說實話，什麼遠古的蠻神，什麼末日之劫，
我根本就搞不懂，也懶得去搞懂。"
382,"TEXT_VOICEMAN_06002_003660_ESTINIEN","我只是在為了實現阿爾菲諾……或者說你們的理想而戰。"
383,"TEXT_VOICEMAN_06002_003670_ESTINIEN","不管接下來的戰鬥有多麼令人絕望，
只要你們需要我的力量，我就會繼續戰鬥下去。"
384,"TEXT_VOICEMAN_06002_003680_ESTINIEN","總之，我就是想說……
是我自己選擇與友人共赴戰場。"
385,"TEXT_VOICEMAN_06002_003690_ESTINIEN","所以你不用有任何顧慮，
儘管讓我去打倒敵人吧。
我會讓他們後悔與我們為敵。"
386,"TEXT_VOICEMAN_06002_003700_ESTINIEN","好了，我估計那對雙胞胎也差不多該追上來了。
借用一下你的陽臺。"
387,"TEXT_VOICEMAN_06002_003710_ESTINIEN","要是他們問起我，你就說“沒見過”。"
388,"TEXT_VOICEMAN_06002_003720_ESTINIEN","那明天見了，夥伴。"
389,"TEXT_VOICEMAN_06002_003730_SYSTEM_NONE_VOICE","不久前 阿拉米格人居住區"
390,"TEXT_VOICEMAN_06002_003740_ALAMHIGANCITIZENA","自從那座詭異的塔消失之後，
大家似乎都安心了不少。"
391,"TEXT_VOICEMAN_06002_003750_ALAMHIGANCITIZENB","是啊，聽說是伊爾薩巴德救援隊在帝國消滅了幕後黑手，
各地的塔就都跟著消失了。"
392,"TEXT_VOICEMAN_06002_003760_ALAMHIGANCITIZENA","真是太謝謝他們了。
也多虧了勞班大人下令加強防備，
我們才沒出現嚴重的損失。"
393,"TEXT_VOICEMAN_06002_003770_ALAMHIGANCITIZENA","可是，救援隊似乎從加雷馬帶回了大量被精煉的帝國人。
真的沒問題嗎……"
394,"TEXT_VOICEMAN_06002_003780_ALAMHIGANCITIZENB","聽勞班大人的意思，
好像是艾奧傑亞各國會負責收治他們，
不過暫時還不會分配給阿拉米格。"
395,"TEXT_VOICEMAN_06002_003790_ALAMHIGANCITIZENA","這樣啊……
那我就放心了。"
396,"TEXT_VOICEMAN_06002_003800_ALAMHIGANCITIZENA","那裡還有不少投奔帝國的阿拉米格人呢……
我可無法歡迎他們回來。"
397,"TEXT_VOICEMAN_06002_003810_ALAMHIGANCITIZENB","是啊……
不過我聽說阿拉加納好像在準備什麼，
可能會先集中在那邊吧……"
398,"TEXT_VOICEMAN_06002_003820_SYSTEM_NONE_VOICE","與此同時 伊修加爾德"
399,"TEXT_VOICEMAN_06002_003830_ERENVILLE","這個委託可真是夠大膽的……"
400,"TEXT_VOICEMAN_06002_003840_ERENVILLE","接下來該怎麼辦呢……"
401,"TEXT_VOICEMAN_06002_003850_ERENVILLE","嗯？"
402,"TEXT_VOICEMAN_06002_003860_ERENVILLE","喂，你沒事吧？"
403,"TEXT_VOICEMAN_06002_003870_ERENVILLE","剛才好像……
是我看錯了嗎？"
404,"TEXT_VOICEMAN_06002_003880_ERENVILLE","現在各地的末日塔都已消失，
帝國的形勢也逐漸趨於穩定……"
405,"TEXT_VOICEMAN_06002_003890_ERENVILLE","可是……為什麼總有一種不太好的感覺……"
