key,0,1
#,,
int32,str,str
0,"TEXT_FESSUM601_03966_SEQ_00","※本任務是特定期間內的任務。

艦尾樓附近的紅蓮祭執行委員瑪雅爾·莫雅爾想要告訴冒險者紅蓮祭已經開始的消息。"
1,"TEXT_FESSUM601_03966_SEQ_01","※本任務只有在季節活動開放期間才能接受和進行。
　季節活動結束後無法進行，敬請注意。
　詳情請參閱官方網站。

從瑪雅爾·莫雅爾那裡聽說了在太陽海岸舉辦的紅蓮祭上，出現了引起巨大騷動的超大型食人鯊的事情。和東拉諾西亞太陽海岸的紅蓮祭執行委員長荷爾瑪伽談談，聽取詳細情況。"
2,"TEXT_FESSUM601_03966_SEQ_02","從荷爾瑪伽那裡聽取了詳情。防鯊組研究員斯瑞希和匿名的炸彈研究者現身，似乎正在研究對策。和太陽海岸的防鯊組研究員斯瑞希交談，了解作戰詳情。"
3,"TEXT_FESSUM601_03966_SEQ_03","和防鯊組研究員斯瑞希進行了交談，學會了鼓勵轟擊怪的「烈焰之舞」。前往太陽海岸的紅蓮祭會場東南邊，完成F.A.T.E.事件「紅蓮祭：人造炎獸大戰食人鯊」，奪回海灘的和平。"
4,"TEXT_FESSUM601_03966_SEQ_04","成功擊退了超級食人鯊。向太陽海岸的紅蓮祭執行委員長荷爾瑪伽報告。"
5,"TEXT_FESSUM601_03966_SEQ_05","向荷爾瑪伽報告了作戰成功。至於福爾扎吉爾身邊帶著的鯊魚幼體，就不去深究了。就這樣，冒險者成功地守護了太陽海岸和紅蓮祭的和平。在終於迎來了和平的海邊，悠閒地跳著烈焰之舞享受紅蓮祭的歡樂吧。"
6,"TEXT_FESSUM601_03966_SEQ_06",""
7,"TEXT_FESSUM601_03966_SEQ_07",""
8,"TEXT_FESSUM601_03966_SEQ_08",""
9,"TEXT_FESSUM601_03966_SEQ_09",""
10,"TEXT_FESSUM601_03966_SEQ_10",""
11,"TEXT_FESSUM601_03966_SEQ_11",""
12,"TEXT_FESSUM601_03966_SEQ_12",""
13,"TEXT_FESSUM601_03966_SEQ_13",""
14,"TEXT_FESSUM601_03966_SEQ_14",""
15,"TEXT_FESSUM601_03966_SEQ_15",""
16,"TEXT_FESSUM601_03966_SEQ_16",""
17,"TEXT_FESSUM601_03966_SEQ_17",""
18,"TEXT_FESSUM601_03966_SEQ_18",""
19,"TEXT_FESSUM601_03966_SEQ_19",""
20,"TEXT_FESSUM601_03966_SEQ_20",""
21,"TEXT_FESSUM601_03966_SEQ_21",""
22,"TEXT_FESSUM601_03966_SEQ_22",""
23,"TEXT_FESSUM601_03966_SEQ_23",""
24,"TEXT_FESSUM601_03966_TODO_00","和太陽海岸的紅蓮祭執行委員長荷爾瑪伽對話"
25,"TEXT_FESSUM601_03966_TODO_01","和防鯊組研究員斯瑞希對話"
26,"TEXT_FESSUM601_03966_TODO_02","完成紅蓮祭會場東南邊的F.A.T.E.事件"
27,"TEXT_FESSUM601_03966_TODO_03","向紅蓮祭執行委員長荷爾瑪伽報告"
28,"TEXT_FESSUM601_03966_TODO_04",""
29,"TEXT_FESSUM601_03966_TODO_05",""
30,"TEXT_FESSUM601_03966_TODO_06",""
31,"TEXT_FESSUM601_03966_TODO_07",""
32,"TEXT_FESSUM601_03966_TODO_08",""
33,"TEXT_FESSUM601_03966_TODO_09",""
34,"TEXT_FESSUM601_03966_TODO_10",""
35,"TEXT_FESSUM601_03966_TODO_11",""
36,"TEXT_FESSUM601_03966_TODO_12",""
37,"TEXT_FESSUM601_03966_TODO_13",""
38,"TEXT_FESSUM601_03966_TODO_14",""
39,"TEXT_FESSUM601_03966_TODO_15",""
40,"TEXT_FESSUM601_03966_TODO_16",""
41,"TEXT_FESSUM601_03966_TODO_17",""
42,"TEXT_FESSUM601_03966_TODO_18",""
43,"TEXT_FESSUM601_03966_TODO_19",""
44,"TEXT_FESSUM601_03966_TODO_20",""
45,"TEXT_FESSUM601_03966_TODO_21",""
46,"TEXT_FESSUM601_03966_TODO_22",""
47,"TEXT_FESSUM601_03966_TODO_23",""
48,"TEXT_FESSUM601_03966_MAYARUMOYARU_000_001","哎呀，這不是以前幫助過我們的冒險者嗎！
怎麼樣，有沒有覺得很熱？一定覺得很熱吧！
那是因為舉辦紅蓮祭的季節到來了！"
49,"TEXT_FESSUM601_03966_MAYARUMOYARU_000_002","哎呀，這位要跑向盛夏海灘旁邊的冒險者！
怎麼樣，有沒有覺得很熱？一定覺得很熱吧！
那是因為舉辦紅蓮祭的季節到來了！"
50,"TEXT_FESSUM601_03966_MAYARUMOYARU_000_003","雖然很想這麼說……
不過，舉辦紅蓮祭的太陽海岸卻被恐怖的氛圍包圍著，
似乎起了什麼騷動。"
51,"TEXT_FESSUM601_03966_MAYARUMOYARU_000_004","根據漁師行會的報告來看，似乎有人在鮮血濱沿岸
看到了超大型的食人鯊……！！"
52,"TEXT_FESSUM601_03966_MAYARUMOYARU_000_005","如果紅蓮祭的參與者中出現傷亡的情況就不妙了！
但是食人鯊不是單靠我們這些執行委員就能對付的傢伙，
所以還是請你這位知名冒險者，務必助我們一臂之力！"
53,"TEXT_FESSUM601_03966_MAYARUMOYARU_000_006","拜託了，請你去太陽海岸的永夏島附近找
紅蓮祭執行委員長荷爾瑪伽了解一下詳情，幫幫忙吧！"
54,"TEXT_FESSUM601_03966_MAYARUMOYARU_000_007","拜託了，請你去太陽海岸的永夏島附近
找紅蓮祭執行委員長荷爾瑪伽了解一下詳情，幫幫忙吧！"
55,"TEXT_FESSUM601_03966_HAERMAGA_000_010","啊，<Highlight>ObjectParameter(1)</Highlight>！
你來了呀！
其實我正想找人幫忙呢……"
56,"TEXT_FESSUM601_03966_HAERMAGA_000_011","你就是來了解事件詳情的冒險者嗎？！
太好了，我們正需要人幫忙呢！"
57,"TEXT_FESSUM601_03966_HAERMAGA_000_012","如你所知，有人在太陽海岸沿岸看到了大型的食人鯊。"
58,"TEXT_FESSUM601_03966_HAERMAGA_000_014","因為是為冒險者行會做宣傳的活動，
如果傳出了客人傷亡的事件可就不妙了……
不但信用會一落千丈，恐怕連來自市民的委託數量都會銳減。"
59,"TEXT_FESSUM601_03966_HAERMAGA_000_015","現在，太陽海岸的土地所有者格格魯玖先生
招聘了對付鯊魚的專家小組。
在他們趕到這裡之前，我想請你跟我一起去巡視沙灘！"
60,"TEXT_FESSUM601_03966_BEACHGUY03966_000_016","是、是鯊魚……！
食人鯊出現了！！"
61,"TEXT_FESSUM601_03966_HAERMAGA_000_017","喂、等等！！
難道說你打算一個人對付那邊那條巨大的鯊魚嗎？！
還是快去叫執行委員或者黑渦團來增援吧！"
62,"TEXT_FESSUM601_03966_Q1_000_000","要說什麼？"
63,"TEXT_FESSUM601_03966_A1_000_001","必須在造成人員傷亡之前阻止它"
64,"TEXT_FESSUM601_03966_A1_000_002","我來這裡就是為了阻止它"
65,"TEXT_FESSUM601_03966_A1_000_003","我在海底遺跡中遇到過類似的魔物"
66,"TEXT_FESSUM601_03966_HAERMAGA_000_019","不愧是熟練的冒險者……
雖然很想這麼說，但這也太魯莽了！"
67,"TEXT_FESSUM601_03966_HAERMAGA_000_020","海底？！
你居然去過那種地方冒險？！
你的意思是，這個鯊魚是從那裡出來的嗎？！"
68,"TEXT_FESSUM601_03966_THRACIE_000_021","(-？？？？-)等一下！
不能毫無準備地去挑戰那條鯊魚！"
69,"TEXT_FESSUM601_03966_HAERMAGA_000_022","你、你們就是格格魯玖先生聘請來的對付鯊魚的專家嗎？！"
70,"TEXT_FESSUM601_03966_THRACIE_000_023","沒錯！我們正是從前對怪獸特種部隊「防爆組」的後繼者——
對巨大食人鯊部隊「防鯊組」！！
我是特任研究員斯瑞希哦！"
71,"TEXT_FESSUM601_03966_BAGO_000_024","呵呵呵呵……
終於到了人家出場的時刻了——！"
72,"TEXT_FESSUM601_03966_HAERMAGA_000_025","防鯊組？！
過去我率領的防爆組居然有了這樣的後繼組織，
我可從來沒聽說過！"
73,"TEXT_FESSUM601_03966_JIRIRI_000_026","嘻嘻嘻，一切都是我家主人，
太陽海岸的土地所有者格格魯玖大人的先見之明。
為了應對可能威脅到太陽海岸的危險，早早地做了準備！"
74,"TEXT_FESSUM601_03966_THRACIE_000_027","那個鯊魚是未知的新物種哦！
而且從行為模式來分析，
它的目標很有可能是從這個海灘登陸！"
75,"TEXT_FESSUM601_03966_HAERMAGA_000_029","登陸？！"
76,"TEXT_FESSUM601_03966_THRACIE_000_030","你會感到吃驚並不奇怪。
不過，所有數據都顯示它有著「登陸」的意圖……
雖然目前並不知道它這樣做的目的。"
77,"TEXT_FESSUM601_03966_THRACIE_000_031","不過，如果人類輕易地去攻擊它的話，
恐怕會讓它記仇，然後變成盤踞在此地的真正的「食人鯊」！
所以，我們要用間接的手段來擊退它！"
78,"TEXT_FESSUM601_03966_THRACIE_000_032","而提供間接手段的就是這位——
將族內秘傳的巨大炸彈培養術提供給我們，
換取稀有鍊金材料的地靈族哦。"
79,"TEXT_FESSUM601_03966_BAGO_000_033","嘿嘿嘿……人家最愛 炸彈了……
而且 和人類聯手的話 還可以獲得很棒的素材……
這就是所謂的 密約吧……"
80,"TEXT_FESSUM601_03966_BAGO_000_034","嘿嘿嘿……好久不見……
不過 要是被族裡知道 洩漏了情報的話 下場會很慘呢。
現在就請你 裝作不認識人家……好嗎？"
81,"TEXT_FESSUM601_03966_BAGO_000_035","炸彈啊 爆炸飛散的瞬間 非常美哦……
人家 會見證 炸彈 爆炸的瞬間……
嘿嘿嘿……這可是 藝術哦……"
82,"TEXT_FESSUM601_03966_THRACIE_000_036","經過一番努力後，我們防鯊組終於成功了。
我們成功地培養出了人工轟擊怪！！
就算對手是那條巨大的鯊魚，也可以將它造成傷害！"
83,"TEXT_FESSUM601_03966_HAERMAGA_000_037","什麼？！轟擊怪？！
那個讓我們苦惱了多年，以致於成為了紅蓮祭由來的大炎獸，
居然可以人工培育出來？！"
84,"TEXT_FESSUM601_03966_THRACIE_000_038","曾經的宿敵，今日居然變成了海岸的守護獸！
是不是讓人很激動呢？！
可以的話，希望你也能來幫忙呢。"
85,"TEXT_FESSUM601_03966_THRACIE_000_039","有你這位敢於獨自挑戰鯊魚的人來幫忙，
實在是太可靠啦！
我們去那邊的安全地帶，來說明一下作戰的詳細內容吧。"
86,"TEXT_FESSUM601_03966_BAGO_000_041","嘿嘿嘿……炸彈要 大展身手了呢！"
87,"TEXT_FESSUM601_03966_JIRIRI_000_042","你想問這身衣服是怎麼回事嗎？
哈哈哈哈哈……我接下來會說明的。"
88,"TEXT_FESSUM601_03966_THRACIE_000_040","準備好了嗎？
那就開始說明作戰內容吧。"
89,"TEXT_FESSUM601_03966_THRACIE_000_043","作戰的要點是，
如何讓人工轟擊怪與鯊魚對峙。"
90,"TEXT_FESSUM601_03966_THRACIE_000_044","據說，過去這裡出現轟擊怪的時候，
人們曾用驅除酷熱炸彈的東方舞蹈「火盆舞」趕走了轟擊怪！"
91,"TEXT_FESSUM601_03966_THRACIE_000_045","根據這個傳說，我們實驗了用舞蹈來指示炸彈的行動。
最後我們發現，由吉麗麗提案的南洋拉拉菲爾族傳來的
「烈焰之舞」有效果！"
92,"TEXT_FESSUM601_03966_JIRIRI_000_045","就由我示範一下烈焰之舞吧。
這是我熟知南洋群島各種習俗的奶奶教給我的舞蹈。"
93,"TEXT_FESSUM601_03966_BAGO_100_046","真棒啊……嘿嘿嘿……
用這優雅的舞蹈 讓大大的炸彈
變得更強 更可愛吧！"
94,"TEXT_FESSUM601_03966_THRACIE_000_046","相傳這是用來鎮撫凶暴火山之神的舞蹈……
這麼看來，也許它具有一定的真實性呢。"
95,"TEXT_FESSUM601_03966_THRACIE_000_047","那麼，就先用小型炸彈來說明一下如何在作戰中跳烈焰之舞吧。
最關鍵的一點就是，利用舞蹈來激勵轟擊怪！"
96,"TEXT_FESSUM601_03966_THRACIE_100_047","等發現食人鯊開始登陸後，我們會在沙灘培育轟擊怪。
不過，新生的人工轟擊怪十分不穩定。
所以，先用「烈焰之舞：燃燒舞步」來為它注入活力吧！"
97,"TEXT_FESSUM601_03966_THRACIE_200_047","只要持續舞蹈，轟擊怪應該就有力量和食人鯊展開激鬥了。
接下來，轟擊怪受到攻擊體力變少的時候，
我們要用「烈焰之舞：青磷舞步」來促進它恢復體力。"
98,"TEXT_FESSUM601_03966_THRACIE_300_047","以上就是全部說明了！
接下來就在沙灘警戒，等食人鯊出現後展開作戰吧！
雖然是個前所未有的計畫，但我們一定能成功的！"
99,"TEXT_FESSUM601_03966_SYSTEM_300_047","為了擊退食人鯊，請前往紅蓮祭會場東南邊
參加F.A.T.E.事件「紅蓮祭：人工炎獸大戰食人鯊」。"
100,"TEXT_FESSUM601_03966_SYSTEM_400_047","根據人工轟擊怪的狀態分別使用兩種「烈焰之舞」
即可削減敵人的體力，驅逐食人鯊。"
101,"TEXT_FESSUM601_03966_JIRIRI_000_048","來吧，冒險者大人，就讓我來教你，練好烈焰之舞，
協助我們擊退威脅沙灘的食人鯊吧！"
102,"TEXT_FESSUM601_03966_SYSTEM_000_050","學會了情感動作「烈焰之舞」！"
103,"TEXT_FESSUM601_03966_THRACIE_000_060","現在由我來指揮防鯊組，
大家一起為作戰成功而努力吧！"
104,"TEXT_FESSUM601_03966_JIRIRI_000_061","如果拉拉菲爾族的舞蹈可以拯救沙灘……
格格魯玖大人應該也會感到驕傲吧！"
105,"TEXT_FESSUM601_03966_BAGO_000_062","呵呵呵……巨大的——強力的——轟擊怪……
會展現怎樣的爆炸呢……？
呵呵呵呵……"
106,"TEXT_FESSUM601_03966_THRACIE_000_065","真是精彩的活躍表現呢！
請向荷爾瑪伽那邊也報告一下吧！"
107,"TEXT_FESSUM601_03966_JIRIRI_000_066","你舞跳得超棒的！"
108,"TEXT_FESSUM601_03966_BAGO_000_067","轟擊怪……
是這個沙灘 最美麗的風景……"
109,"TEXT_FESSUM601_03966_HAERMAGA_000_070","沒想到真的成功了呀！
看著在烈焰之舞的鼓舞下，熊熊燃燒的人工轟擊怪，
連我都變得熱血起來了！"
110,"TEXT_FESSUM601_03966_THRACIE_000_071","作戰居然進行得這麼順利！
身為防鯊組的研究員，我感到無比自豪！
連整個靈魂都在顫抖……不，是在熊熊燃燒！"
111,"TEXT_FESSUM601_03966_BAGO_000_072","轟擊怪的英姿……
就是藝術！
謝謝你讓人家看到這麼棒的情景！"
112,"TEXT_FESSUM601_03966_HAERMAGA_000_073","嗯，這下海灘恢復了平靜，
紅蓮祭應該也可以正常舉辦了。"
113,"TEXT_FESSUM601_03966_THRACIE_000_074","不過，那條鯊魚的進化疑點頗多……
為什麼魚鰭會進化成手腳呢……
為什麼會想登陸呢……"
114,"TEXT_FESSUM601_03966_THRACIE_000_075","咦、咦咦？！"
115,"TEXT_FESSUM601_03966_FOERZAGYL_000_076","哎呀，不好意思！
我家寵物逃了出來，
似乎跑到了這一帶……哦哦在這呢。"
116,"TEXT_FESSUM601_03966_THRACIE_000_077","你是漁師行會的福爾扎吉爾船長？！
這、這個生物到底是？！"
117,"TEXT_FESSUM601_03966_FOERZAGYL_000_078","是說這個小傢伙嗎？
很可愛吧。
是個很有冒險精神的傢伙呢，無論去哪裡都會跟著我。"
118,"TEXT_FESSUM601_03966_FOERZAGYL_000_079","我是大型漁船的船長，
經常會乘船到海上去享受釣魚的樂趣，
沒想到會釣到這種小鯊魚。"
119,"TEXT_FESSUM601_03966_FOERZAGYL_100_079","它現在已經是我親密的航海夥伴了。
找到它真是太好了，我先走一步了啊！"
120,"TEXT_FESSUM601_03966_HAERMAGA_000_080","難道說，那條巨大的鯊魚，
登陸是想要尋找自己的這個小鯊魚嗎……"
121,"TEXT_FESSUM601_03966_JIRIRI_000_081","不對不對，鯊魚怎麼會有那種智慧呢……
不過，那條小鯊魚還真是喜歡福爾扎吉爾船長呢。"
122,"TEXT_FESSUM601_03966_THRACIE_000_082","總之，在我們防鯊組的活躍表現下，成功地保證了紅蓮祭的安全，
還守護了福爾扎吉爾船長和他小小朋友的羈絆，
這都是好事！"
123,"TEXT_FESSUM601_03966_BAGO_000_083","美麗熱烈 轟擊怪……
也棒極了……"
124,"TEXT_FESSUM601_03966_JIRIRI_000_084","嗯……說得對！
格格魯玖大人一定也十分滿意！"
125,"TEXT_FESSUM601_03966_HAERMAGA_000_085","真是的……不過，這次真的幫了大忙。
如果紅蓮祭再次出現了危機的話，
就再用烈焰之舞與炎獸一起迎難而上吧！"
126,"TEXT_FESSUM601_03966_THRACIE_000_028","（★未使用／削除予定★）"
127,"TEXT_FESSUM601_03966_THRACIE_000_037","（★未使用／削除予定★）"
128,"TEXT_FESSUM601_03966_HAERMAGA_000_038","（★未使用／削除予定★）"
129,"TEXT_FESSUM601_03966_SYSTEM_500_047","（★未使用／削除予定★）"
130,"TEXT_FESSUM601_03966_THRACIE_000_049","（★未使用／削除予定★）"
131,"TEXT_FESSUM601_03966_BAGO_000_050","（★未使用／削除予定★）"
132,"TEXT_FESSUM601_03966_BAGO_000_051","（★未使用／削除予定★）"
133,"TEXT_FESSUM601_03966_JIRIRI_000_052","（★未使用／削除予定★）"
134,"TEXT_FESSUM601_03966_THRACIE_000_053","（★未使用／削除予定★）"
